<?xml version="1.0"?>
<!DOCTYPE source SYSTEM "source.dtd">
<source>
        <name>Reddit</name>
        <keys>
            <key>application_id</key>
            <key>application_secret</key>
        </keys>
        <children>
            <node>
                <name>Search</name>
                <function>search</function>
                <inputs>
                    <input>
                        <name required="true">query</name>
                        <type>primary</type>
                    </input>
                    <input>
                        <name>Arguments</name>
                        <type>arguments</type>
                        <columns>
                            <column>Argument</column>
                            <column>Value</column>
                        </columns>
                        <setters>
                            <setter>
                                <name>Order</name>
                                <argument>order</argument>
                                <value>top,new,relevance,comments</value>
                                <type>list</type>
                            </setter>
                            <setter>
                                <name>Count</name>
                                <argument>count</argument>
                                <value>1000</value>
                                <type>counter</type>
                            </setter>
                            <setter>
                                <name>Time period</name>
                                <argument>time_period</argument>
                                <value>all,year,month,week,today,hour</value>
                                <type>list</type>
                            </setter>
                        </setters>
                    </input>
                </inputs>
                <children/>
            </node>
            <node>
                <name>Subreddit</name>
                <function>subreddit</function>
                <inputs>
                    <input>
                        <name required="true">subreddit</name>
                        <type>primary</type>
                    </input>
                    <input>
                        <name>Arguments</name>
                        <type>arguments</type>
                        <columns>
                            <column>Argument</column>
                            <column>Value</column>
                        </columns>
                        <setters>
                            <setter>
                                <name>Category</name>
                                <argument>category</argument>
                                <value>top,new,hot,rising,controversial</value>
                                <type>list</type>
                            </setter>
                            <setter>
                                <name>Count</name>
                                <argument>count</argument>
                                <value>1000</value>
                                <type>counter</type>
                            </setter>
                            <setter>
                                <name>Time period</name>
                                <argument>time_period</argument>
                                <value>all,year,month,week,today,hour</value>
                                <type>list</type>
                            </setter>
                        </setters>
                    </input>
                </inputs>
                <children/>
            </node>
            <node>
                <name>User</name>
                <function>user</function>
                <inputs>
                    <input>
                        <name required="true">user</name>
                        <type>primary</type>
                    </input>
                    <input>
                        <name>Arguments</name>
                        <type>arguments</type>
                        <columns>
                            <column>Argument</column>
                            <column>Value</column>
                        </columns>
                        <setters>
                            <setter>
                                <name>Result type</name>
                                <argument>result_type</argument>
                                <value>overview,submitted,comments,guilded</value>
                                <type>list</type>
                            </setter>
                            <setter>
                                <name>Count</name>
                                <argument>count</argument>
                                <value>1000</value>
                                <type>counter</type>
                            </setter>
                            <setter>
                                <name>Order</name>
                                <argument>time_period</argument>
                                <value>new,hot,top,controversial</value>
                                <type>list</type>
                            </setter>
                        </setters>
                    </input>
                </inputs>
                <children/>
            </node>
        </children>
</source>